{
  "$schema": "https://json-schema.org/draft/2020-12/schema",
  "$id": "https://ui-tool.local/schemas/screen.schema.json",
  "title": "UI Tool Neutral Screen Definition",
  "type": "object",
  "required": ["schemaVersion", "tool", "page", "components"],
  "properties": {
    "schemaVersion": {
      "type": "string"
    },
    "tool": {
      "type": "object",
      "required": ["name", "artifactType"],
      "properties": {
        "name": { "type": "string" },
        "artifactType": { "const": "page-definition" },
        "description": { "type": "string" }
      },
      "additionalProperties": true
    },
    "page": {
      "type": "object",
      "required": ["id", "name", "component"],
      "properties": {
        "id": { "type": "string" },
        "name": { "type": "string" },
        "route": { "type": "string" },
        "framework": { "type": "string" },
        "component": { "$ref": "#/$defs/componentType" },
        "sourceVuePath": { "type": "string" },
        "targetVuePath": { "type": "string" }
      },
      "additionalProperties": true
    },
    "data": {
      "type": "object"
    },
    "components": {
      "type": "array",
      "items": {
        "$ref": "#/$defs/component"
      }
    },
    "script": {
      "type": "object",
      "properties": {
        "src": { "type": "string" }
      },
      "additionalProperties": true
    },
    "datasets": {
      "type": "array"
    },
    "stores": {
      "type": "array",
      "items": {
        "type": "object",
        "required": ["variableName", "constName", "defineStoreId", "sourcePath"],
        "properties": {
          "variableName": { "type": "string", "pattern": "^[A-Za-z_$][A-Za-z0-9_$]*$" },
          "constName": { "type": "string", "pattern": "^[A-Za-z_$][A-Za-z0-9_$]*$" },
          "defineStoreId": { "type": "string" },
          "sourcePath": { "type": "string" }
        },
        "additionalProperties": true
      }
    },
    "imports": {
      "type": "array",
      "items": {
        "type": "object",
        "required": ["name", "from"],
        "properties": {
          "type": { "type": "string" },
          "name": { "type": "string", "pattern": "^[A-Za-z_$][A-Za-z0-9_$]*$" },
          "from": { "type": "string" },
          "variableName": { "type": "string", "pattern": "^[A-Za-z_$][A-Za-z0-9_$]*$" },
          "value": { "type": "string" },
          "sourcePath": { "type": "string" },
          "defineStoreId": { "type": "string" }
        },
        "additionalProperties": true
      }
    },
    "generation": {
      "type": "object"
    }
  },
  "additionalProperties": true,
  "$defs": {
    "componentType": {
      "type": "string",
      "enum": [
        "Page",
        "Layout",
        "PageContainer",
        "Button",
        "Input",
        "Select",
        "Toggle",
        "Card",
        "CardSection",
        "Table",
        "List",
        "ListItem",
        "ListItemSection",
        "Separator",
        "HtmlElement",
        "FormTemplate"
      ]
    },
    "component": {
      "type": "object",
      "required": ["id", "type"],
      "properties": {
        "id": { "type": "string" },
        "type": { "$ref": "#/$defs/componentType" },
        "tag": { "type": "string" },
        "class": { "type": "string" },
        "style": { "type": "string" },
        "label": { "type": "string" },
        "text": {},
        "textBinding": { "type": "string" },
        "props": { "type": "object" },
        "dynamicProps": { "type": "object" },
        "models": { "type": "object" },
        "events": { "type": "object" },
        "repeat": { "type": "object" },
        "designer": { "type": "object" },
        "children": {
          "type": "array",
          "items": {
            "$ref": "#/$defs/component"
          }
        }
      },
      "additionalProperties": true
    }
  }
}
